{
  "schema_version": "1.0",
  "agent_type": "SignalDetectionAgent",
  "agent_id": "SignalDetectionAgent-00000000",
  "privilege_tier": "standard",
  "allowed_tools": [
    "query_graph",
    "semantic_search",
    "get_entity",
    "get_relationships",
    "find_paths",
    "validate_input"
  ],
  "denied_tools": [
    "update_opportunity",
    "export_to_crm",
    "send_notification",
    "export_document",
    "generate_section"
  ],
  "invariants": {
    "max_tool_calls_per_run": 30,
    "budget_limit_usd": 2.00,
    "require_human_approval": [],
    "custom": {
      "max_signals_per_request": 10,
      "evidence_match_limit": 5
    }
  },
  "metadata": {
    "description": "Monitors data streams for operational pain signals, buying intent, and trigger events. Orchestrates Layer 2 extraction and Layer 3 evidence matching.",
    "owner": "platform-team",
    "last_reviewed": "2026-04-27"
  }
}
