{
  "schema_version": "1.0",
  "agent_type": "ConversationAgent",
  "agent_id": "ConversationAgent-00000000",
  "privilege_tier": "standard",
  "allowed_tools": [
    "query_graph",
    "semantic_search",
    "get_entity",
    "get_relationships",
    "traverse_tree",
    "find_paths",
    "evaluate_formula",
    "calculate_roi",
    "compare_benchmarks",
    "analyze_competition",
    "get_prospect_data",
    "fetch_interaction_history",
    "generate_section",
    "create_chart",
    "format_table",
    "export_document",
    "validate_input",
    "format_currency"
  ],
  "denied_tools": [
    "update_opportunity",
    "export_to_crm",
    "send_notification",
    "score_lead",
    "create_task",
    "schedule_meeting"
  ],
  "invariants": {
    "max_tool_calls_per_run": 15,
    "budget_limit_usd": 2.00,
    "require_human_approval": [
      "export_document"
    ],
    "custom": {
      "max_response_tokens": 4096,
      "max_delegation_depth": 1,
      "session_timeout_seconds": 1800
    }
  },
  "metadata": {
    "description": "User-facing copilot (ValuePilot). Receives chat messages from the RightRail, interprets intent, delegates to spine agents, and streams responses.",
    "display_name": "ValuePilot",
    "owner": "platform-team",
    "last_reviewed": "2026-04-27"
  }
}
