{
  "schema_version": "1.0",
  "agent_type": "ContextExtractionAgent",
  "agent_id": "ContextExtractionAgent-00000000",
  "privilege_tier": "standard",
  "allowed_tools": [
    "query_graph",
    "semantic_search",
    "get_entity",
    "get_relationships",
    "traverse_tree",
    "find_paths",
    "validate_input"
  ],
  "denied_tools": [
    "update_opportunity",
    "export_to_crm",
    "send_notification",
    "export_document"
  ],
  "invariants": {
    "max_tool_calls_per_run": 50,
    "budget_limit_usd": 3.00,
    "require_human_approval": [],
    "custom": {
      "max_extraction_sources": 20,
      "min_pain_points_for_gate": 3
    }
  },
  "metadata": {
    "description": "Extracts customer context — profile, stakeholders, pain points, and financial data from ingested sources. Produces ContextArtifact.",
    "owner": "platform-team",
    "last_reviewed": "2026-04-27"
  }
}
