{
  "schema_version": "1.0",
  "agent_type": "CompetitiveIntelAgent",
  "agent_id": "CompetitiveIntelAgent-00000000",
  "privilege_tier": "elevated",
  "allowed_tools": [
    "query_graph",
    "semantic_search",
    "get_entity",
    "get_relationships",
    "find_paths",
    "analyze_competition",
    "compare_benchmarks",
    "validate_input",
    "format_currency"
  ],
  "denied_tools": [
    "update_opportunity",
    "export_to_crm",
    "send_notification",
    "score_lead"
  ],
  "invariants": {
    "max_tool_calls_per_run": 40,
    "budget_limit_usd": 5.00,
    "require_human_approval": [],
    "custom": {
      "max_competitors_per_analysis": 6,
      "max_external_api_calls": 10
    }
  },
  "metadata": {
    "description": "Analyzes competitive landscape, economic differentiators, and market positioning. Produces CompetitiveIntelArtifact.",
    "owner": "platform-team",
    "last_reviewed": "2026-04-27"
  }
}
